{
  "schemaVersion": 1,
  "documentType": "listening-exercise-extension-index",
  "extensionId": "survival-travel-american-listening-exercises",
  "extensionVersion": "1.2.0",
  "status": "released",
  "baseCourseId": "survival-travel-american-4w",
  "basePackageVersion": "1.0.0",
  "basePackageIndex": "content/curriculum/package-index.v1.json",
  "targetLocale": "en-US",
  "supportLocale": "zh-CN",
  "exerciseBundleFiles": [
    "content/lessons/survival-travel-american-4w/listening-exercises.v1.json"
  ],
  "bilingualChoiceOptionsFile": "content/lessons/survival-travel-american-4w/listening-choice-bilingual-options.v1.json",
  "schemaFiles": [
    "content/curriculum/listening-exercise-extension-index.schema.v1.json",
    "content/curriculum/listening-exercise-bundle.schema.v1.json",
    "content/curriculum/listening-choice-bilingual-options.schema.v1.json"
  ],
  "documentationFiles": [
    "content/curriculum/content-package-contract.v1.md",
    "content/curriculum/listening-exercise-handoff-v1.md",
    "content/curriculum/handoff-v1.md"
  ],
  "compatibility": {
    "mode": "additive-extension",
    "corePackageMutation": false,
    "existingContentRefsChanged": false
  },
  "retainedExistingExercises": {
    "unitChecksPath": "lesson.learningUnits[domain=listening].activity.checks",
    "sceneQuizPath": "lesson.sceneQuiz[domain=listening]"
  },
  "totals": {
    "lessons": 28,
    "segments": 900,
    "exercises": 900,
    "wordDiscrimination": 28,
    "shortSentenceChoice": 84,
    "keywordDictation": 788
  }
}
